<?xml version="1.0" encoding="UTF-8"?>
<!DOCTYPE ha-jdbc SYSTEM "file:///C:/ha-jdbc/doc/src/content/dtd/ha-jdbc-1.0.dtd">
<ha-jdbc>
	<distributable protocol=""/>
	<cluster name="">
		<validate-sql>SELECT 1</validate-sql>
		<create-foreign-key-sql>ALTER TABLE {1} ADD CONSTRAINT FOREIGN KEY {0} REFERENCES {2} ({3})</create-foreign-key-sql>
		<drop-foreign-key-sql>ALTER TABLE {1} DROP CONSTRAINT {0}</drop-foreign-key-sql>
		<create-index-sql>CREATE INDEX {0} ON {1} ({2})</create-index-sql>
		<drop-index-sql>DROP INDEX {0}</drop-index-sql>
		<database url="" driver="">
			<user></user>
			<password></password>
		</database>
	</cluster>
	<cluster name="">
		<validate-sql></validate-sql>
		<
	</cluster>
	<cluster name="">
		<datasource name=""></datasource>
	</cluster>
</ha-jdbc>